{
  "schemaVersion": 1,
  "kind": "nutrition",
  "title": "Yoddha prep meals: pilot week (13-19 Oct), Aryan",
  "planKey": "yoddha_prep_nutrition",
  "versionNote": "Pilot week, approved 13 Oct 2026. Fully vegetarian and egg-free (festival to 20 Oct; Mon/Thu vegetarian).",
  "status": "approved",
  "startDate": "2026-10-13",
  "endDate": "2026-10-19",
  "assumptions": [
    "Aryan's diet rules are the same as Chinmay's (vegetarian Mon/Thu and 11-20 Oct). His egg rule is unknown, so eggs are excluded; every day 13-19 Oct is vegetarian and egg-free.",
    "Protein powder is already purchased. It's priced at an estimate (₹2,500/kg) because the format can't exclude a food from the budget, so the app's daily cost includes it.",
    "A spice allowance of about ₹10/day (salt, spices, ginger, garlic, chilli, lemon, coriander) isn't in the app's cost.",
    "Vegetable and fruit prices are Mumbai aggregator prices from 12 Oct; packaged goods are DMart / BigBasket listings from 13 Oct. Check against your own shop.",
    "Energy targets are estimates; calibrate with the weekly body-weight trend."
  ],
  "athlete": "aryan",
  "budgetInrPerDay": 250,
  "targets": {
    "kcal": [
      2700,
      3250
    ],
    "proteinG": [
      125,
      145
    ],
    "carbsG": [
      310,
      500
    ],
    "fatG": [
      60,
      90
    ],
    "fibreG": [
      35,
      60
    ],
    "fluidNote": "About 3.5 L a day as a starting point, more on hot days; pale-yellow urine is the check. 400-750 ml in the 2-4 h before training; sip 400-800 ml per hour during. After a sweaty session replace about 1.25-1.5 L per kg lost, with salt (salted food or ORS). Weighing more after a session than before means you drank too much.",
    "rationale": "Mifflin-St Jeor resting energy about 1,760 kcal x activity 1.7-1.85 (evening training + some morning runs). Training days 2,950-3,250 kcal and carbs 385-500 g; rest days 2,700-2,950 kcal and carbs 310-440 g. Protein 1.6-1.9 g/kg (ISSN 1.4-2.0). No deficit: calibrate with the weekly body-weight trend."
  },
  "foods": [
    {
      "key": "poha_thick",
      "name": "Poha, thick",
      "dietTag": "veg",
      "per100g": {
        "kcal": 353.7,
        "proteinG": 7.44,
        "carbsG": 76.75,
        "fatG": 1.14,
        "fibreG": 3.46
      },
      "householdMeasures": [
        {
          "label": "1 cup",
          "grams": 60
        }
      ],
      "source": "IFCT 2017 A011",
      "isEstimate": false
    },
    {
      "key": "potato",
      "name": "Potato",
      "dietTag": "veg",
      "per100g": {
        "kcal": 69.8,
        "proteinG": 1.54,
        "carbsG": 14.89,
        "fatG": 0.23,
        "fibreG": 1.71
      },
      "householdMeasures": [
        {
          "label": "1 medium potato",
          "grams": 120
        }
      ],
      "source": "IFCT 2017 F006",
      "isEstimate": false
    },
    {
      "key": "onion",
      "name": "Onion",
      "dietTag": "veg",
      "per100g": {
        "kcal": 48.0,
        "proteinG": 1.5,
        "carbsG": 9.56,
        "fatG": 0.24,
        "fibreG": 2.45
      },
      "householdMeasures": [
        {
          "label": "1 medium onion",
          "grams": 100
        }
      ],
      "source": "IFCT 2017 G017",
      "isEstimate": false
    },
    {
      "key": "green_peas_frozen",
      "name": "Green peas, frozen",
      "dietTag": "veg",
      "per100g": {
        "kcal": 81.3,
        "proteinG": 7.25,
        "carbsG": 11.88,
        "fatG": 0.13,
        "fibreG": 6.32
      },
      "householdMeasures": [
        {
          "label": "1 tbsp",
          "grams": 10
        }
      ],
      "source": "IFCT 2017 D061 fresh green peas, used as a proxy for frozen peas",
      "isEstimate": true
    },
    {
      "key": "peanuts_raw",
      "name": "Peanuts, raw",
      "dietTag": "veg",
      "per100g": {
        "kcal": 520.1,
        "proteinG": 23.65,
        "carbsG": 17.27,
        "fatG": 39.63,
        "fibreG": 10.38
      },
      "householdMeasures": [
        {
          "label": "1 tbsp",
          "grams": 9
        }
      ],
      "source": "IFCT 2017 H012",
      "isEstimate": false
    },
    {
      "key": "cooking_oil",
      "name": "Cooking oil (groundnut or sunflower)",
      "dietTag": "veg",
      "per100g": {
        "kcal": 884,
        "proteinG": 0.0,
        "carbsG": 0.0,
        "fatG": 100.0,
        "fibreG": 0.0
      },
      "householdMeasures": [
        {
          "label": "1 tsp",
          "grams": 4.5
        }
      ],
      "source": "USDA FDC 171410",
      "isEstimate": false
    },
    {
      "key": "dahi_toned",
      "name": "Dahi (toned milk)",
      "dietTag": "veg",
      "per100g": {
        "kcal": 61.5,
        "proteinG": 4.0,
        "carbsG": 4.4,
        "fatG": 3.1,
        "fibreG": 0.0
      },
      "householdMeasures": [
        {
          "label": "1 katori",
          "grams": 150
        }
      ],
      "source": "Amul Masti Dahi label (toned milk, fat 3.1%). Fibre 0: dairy contains no dietary fibre (USDA yogurt 171284 = 0).",
      "isEstimate": false
    },
    {
      "key": "atta_whole_wheat",
      "name": "Whole wheat atta",
      "dietTag": "veg",
      "per100g": {
        "kcal": 320.3,
        "proteinG": 10.57,
        "carbsG": 64.17,
        "fatG": 1.53,
        "fibreG": 11.36
      },
      "householdMeasures": [
        {
          "label": "1 roti (dough)",
          "grams": 30
        }
      ],
      "source": "IFCT 2017 A019",
      "isEstimate": false
    },
    {
      "key": "rice_white_raw",
      "name": "White rice, raw (sona masoori / kolam)",
      "dietTag": "veg",
      "per100g": {
        "kcal": 356.4,
        "proteinG": 7.94,
        "carbsG": 78.24,
        "fatG": 0.52,
        "fibreG": 2.81
      },
      "householdMeasures": [
        {
          "label": "1 katori cooked rice (about 50 g raw)",
          "grams": 50
        }
      ],
      "source": "IFCT 2017 A015",
      "isEstimate": false
    },
    {
      "key": "moong_dal_yellow",
      "name": "Moong dal, yellow",
      "dietTag": "veg",
      "per100g": {
        "kcal": 325.8,
        "proteinG": 23.88,
        "carbsG": 52.59,
        "fatG": 1.35,
        "fibreG": 9.37
      },
      "householdMeasures": [
        {
          "label": "1 katori cooked dal (about 35 g raw)",
          "grams": 35
        }
      ],
      "source": "IFCT 2017 B010",
      "isEstimate": false
    },
    {
      "key": "bhindi_okra",
      "name": "Bhindi / okra",
      "dietTag": "veg",
      "per100g": {
        "kcal": 27.5,
        "proteinG": 2.08,
        "carbsG": 3.62,
        "fatG": 0.22,
        "fibreG": 4.08
      },
      "householdMeasures": [
        {
          "label": "1 katori chopped",
          "grams": 75
        }
      ],
      "source": "IFCT 2017 D056",
      "isEstimate": false
    },
    {
      "key": "tomato",
      "name": "Tomato",
      "dietTag": "veg",
      "per100g": {
        "kcal": 18.9,
        "proteinG": 0.76,
        "carbsG": 3.2,
        "fatG": 0.25,
        "fibreG": 1.58
      },
      "householdMeasures": [
        {
          "label": "1 medium tomato",
          "grams": 90
        }
      ],
      "source": "IFCT 2017 D075",
      "isEstimate": false
    },
    {
      "key": "banana",
      "name": "Banana, ripe (edible part)",
      "dietTag": "veg",
      "per100g": {
        "kcal": 105.2,
        "proteinG": 1.23,
        "carbsG": 23.63,
        "fatG": 0.33,
        "fibreG": 1.94
      },
      "householdMeasures": [
        {
          "label": "1 medium banana (edible part)",
          "grams": 120
        }
      ],
      "source": "IFCT 2017 E012",
      "isEstimate": false
    },
    {
      "key": "toned_milk",
      "name": "Toned milk",
      "dietTag": "veg",
      "per100g": {
        "kcal": 56.3,
        "proteinG": 2.91,
        "carbsG": 4.56,
        "fatG": 2.91,
        "fibreG": 0.0
      },
      "householdMeasures": [
        {
          "label": "1 glass (250 ml)",
          "grams": 258
        }
      ],
      "source": "Amul Taaza label per 100 ml (58 kcal, P 3.0, C 4.7, F 3.0), converted to per 100 g at 1.031 g/ml",
      "isEstimate": false
    },
    {
      "key": "whey_protein",
      "name": "Whey protein (Aryan's)",
      "dietTag": "veg",
      "per100g": {
        "kcal": 400.0,
        "proteinG": 80.0,
        "carbsG": 10.0,
        "fatG": 5.0,
        "fibreG": 0.0
      },
      "householdMeasures": [
        {
          "label": "1 scoop (estimated)",
          "grams": 30
        }
      ],
      "source": "ESTIMATE for a typical whey concentrate (about 24 g protein per 30 g scoop; fibre 0, as whey contains none). Replace with Aryan's label.",
      "isEstimate": true
    },
    {
      "key": "soy_chunks_dry",
      "name": "Soy chunks, dry",
      "dietTag": "veg",
      "per100g": {
        "kcal": 345,
        "proteinG": 52.0,
        "carbsG": 20.0,
        "fatG": 0.67,
        "fibreG": 13.3
      },
      "householdMeasures": [
        {
          "label": "1 cup dry",
          "grams": 45
        }
      ],
      "source": "Nutrela soya chunks label via Open Food Facts 8906032016977. Carbs = label total 33.3 g minus fibre 13.3 g. Moderate confidence: check your pack.",
      "isEstimate": true
    },
    {
      "key": "ghee",
      "name": "Ghee",
      "dietTag": "veg",
      "per100g": {
        "kcal": 876,
        "proteinG": 0.28,
        "carbsG": 0.0,
        "fatG": 99.48,
        "fibreG": 0.0
      },
      "householdMeasures": [
        {
          "label": "1 tsp",
          "grams": 4.5
        }
      ],
      "source": "USDA FDC 173412",
      "isEstimate": false
    },
    {
      "key": "cucumber",
      "name": "Cucumber",
      "dietTag": "veg",
      "per100g": {
        "kcal": 19.6,
        "proteinG": 0.71,
        "carbsG": 3.48,
        "fatG": 0.16,
        "fibreG": 2.14
      },
      "householdMeasures": [
        {